{
  "sandbox_id": "sandbox-1",
  "tenant_id": "tenant-1",
  "work_order_id": "work-order-1",
  "workspace_id": "workspace-1",
  "provider_revision_id": "provider-revision-local-v1",
  "desired_state": "ready",
  "observed_state": "requested",
  "generation": 1,
  "observed_generation": 0,
  "runtime_profile": "sandbox-runtime-default-v1",
  "lease_expires_at": "2026-08-20T01:00:00Z",
  "created_at": "2026-08-20T00:00:01Z",
  "updated_at": "2026-08-20T00:00:01Z",
  "sandbox_slot_key": "primary-code"
}
